{
  "caller": {
    "operations": [
      {
        "bits": "4000000000000000",
        "op": "suss.const"
      },
      {
        "arguments": [
          1
        ],
        "callee": 0,
        "op": "suss.call"
      }
    ],
    "parameters": [
      {
        "arity": 1,
        "captures": [
          {
            "kind": "f64"
          }
        ],
        "kind": "closure"
      }
    ],
    "return_value": 2
  },
  "expected_bits": "4022000000000000",
  "producer": {
    "operations": [
      {
        "bits": "401c000000000000",
        "op": "suss.const"
      },
      {
        "arity": 1,
        "body": {
          "operations": [
            {
              "lhs": 0,
              "op": "suss.add",
              "rhs": 1
            }
          ],
          "parameters": [
            {
              "kind": "f64"
            },
            {
              "kind": "f64"
            }
          ],
          "return_value": 2
        },
        "captures": [
          0
        ],
        "op": "suss.closure"
      }
    ],
    "parameters": [],
    "return_value": 1
  },
  "schema": "suss.mlir.bridge.v1",
  "verified_mlir": true
}
